{"$schema":"https://json-schema.org/draft/2020-12/schema","$id":"novi.model-invocation/1.0.0","title":"ModelInvocation","type":"object","additionalProperties":false,"required":["invocation_id","model_id","model_version","artifact_digest","runtime","runtime_version","hardware","input_schema_version","output_schema_version","started_at","completed_at","latency","provenance"],"properties":{"invocation_id":{"type":"string"},"model_id":{"type":"string"},"model_version":{"type":"string"},"artifact_digest":{"type":"string"},"runtime":{"type":"string"},"runtime_version":{"type":"string"},"hardware":{},"input_schema_version":{"type":"string"},"output_schema_version":{"type":"string"},"started_at":{"type":"string","format":"date-time"},"completed_at":{"type":"string","format":"date-time"},"latency":{},"token_compute_usage":{},"request_result_refs":{},"policy_context":{},"provenance":{}}}